{
  "id": "712508",
  "horse": "example-value",
  "sire": "example-value",
  "sire_id": "329872",
  "dam": "example-value",
  "dam_id": "769900",
  "damsire": "example-value",
  "damsire_id": "252815",
  "total_runs": 82,
  "distances": [
    "example-value"
  ],
  "query": [
    [
      "example-value"
    ]
  ]
}